KL Old Klang Road D Sand Residence Fully Furnished Unit,Old Klang Road,730,2 500
"Abdullah Hukum Apartment, LRT Mid Valley Bangsar Putra Sri KL Eco City",Mid Valley City,800,1 700
New Unit M CenTuRa 5 STaR FaciLiTies FRee WiFi SenTuL LinK,Sentul,850,1 750
"WTL (Low Price in Town) Legasi Kampong Bharu, Kampung Baru KLCC",KL City,807,2 000
[4 Room] Sky Vista Residen KL City Line,Cheras,1560,2 100
KL Pertiwi Indah Condo Fully Furnish,Cheras,1298,2 050
"Villa Orkid Condominium @ Prima Pelangi , Segambut, Kuala Lumpur",Segambut,1893,1 900
PPA1M Bukit Jalil | Partially Furnish | 3R2B | Walking Distance To LRT,Bukit Jalil,1200,1 350
Unio Residence Kepong Super best deal in town ready move in,Kepong,866,1 699
For Rent Paraiso @ The Earth Bukit Jalil,Bukit Jalil,1101,2 300
"For Rent!! Cheras, Altitude 236 Condominium",Cheras,1808,3 000
[3 Rooms] PPA1M 5mins Walk to LRT Ready for move in 2 Mins to Hwy BJ,Bukit Jalil,1200,1 100
"【FULLY FURNISHED】 M Centura, Jalan Sentul Pasar, Sentul Point, Fennel",Sentul,850,2 100
Axis Residence Ampang,Ampang,750,1 400
Seasons Garden PV21 770sf 3R2B Partially Furnished,Wangsa Maju,770,1 499
"Fully furnished,Trinity Lemanja,move in condition,Brand new,MUST VIEW",Kepong,977,2 100
Bandar Sri Damansara Foresta Condo Fully Furnished Kepong Corner,Sri Damansara,1610,2 300
BLlock 40 Taman Sri Sentosa,Old Klang Road,900,1 100
Majestic Maxim Cheras Connaught Leisure Mall Eko KL AREA🚶7min to MRT,Cheras,850,976
"WTL Sri Jati 1, Jalan Klang Lama (Old Klang Road), Kuala Lumpur",Old Klang Road,950,1 250
Pangsapuri Sri Penara Cheras for rent,Cheras,650,950
Majestic Maxim Cheras Connaught Leisure Mall Eko KL AREA🚶7min to MRT,Cheras,850,977
bukit Pandan 1 condo | Pandan Heights | Pandan Perdana | for rent,Cheras,1100,1 600
"V Residence @ Sunway Velocity, Cheras",Cheras,1004,1 500
"Skyawani 3 Residensi, Jalan Ayer Keroh,Setapak,Kuala Lumpur",Setapak,800,2 000
"Best Price Inspirasi Mont Kiara Condominium, The Richmond Mont Kiara",Mont Kiara,940,3 350
"Binjai Residence, Klcc",KLCC,2326,6 500
D'Suria Condo Ampang Hilir,Ampang,1060,2 300
Astaka Heights apartment ,KL City,1090,1 600
"VUE Residences, 2 Rooms F/Furnished, HKL HTA LRT TR Titiwangsa Sentral",Titiwangsa,726,1 900
"Pertiwi Indah 1298sf 3R2B F/Furnish For Rent , Cheras , Maluri",Cheras,1298,2 100
ZeTaParK oN ToP SeTaPak CenTRaL MaLL 4 BiLiK FuLLy FurNisheD,Setapak,1281,2 500
Bayu Tasik 1 Condominum to let! Near LRT and clean unit!!,Cheras,920,1 400
[Sewa Paling Murah] Alam Damai Cheras l Apartment l Desa Cheras,Cheras,850,750
28 Boulevard @ Cheras Pandan Perdana FOR RENT,Pandan Perdana,450,1 600
ConDoMiNiuM SeTaPaK 4 BiLik 2 CarParK PriMe LocaTiOn Near SHoP SekOLah,Setapak,1408,2 600
FuLLy FurNisheD 100% Tuan ReSideNCy Iconic BaBa NyoNYa ResiDenCe,Jalan Kuching,878,2 300
Dahlia Apartment Pandan Indah,Ampang,741,1 000
"Flexus Signature Suites @ Jalan Kuching @ KL City, Kuala Lumpur RENT",Jalan Kuching,550,1 200
"Prima Midah Height , HUKM , Taman Midah , CHERAS ,",Cheras,1500,1 800
"Kiara Ville , Solaris Mont Kiara ,",Mont Kiara,1593,4 500
FuLLy FurNiSheD TR ResiDeNce 3 RooMs JaLaN TuN Razak LRT TiTiwngsa,Titiwangsa,850,3 000
"Flat Damai Jaya ,Batu 9 ,Cheras ,Kuala Lumpur",Cheras,600,650
"Widuri Impian Condominium @ Taman Desa Petaling, Kuala Lumpur for RENT",Desa Petaling,960,1 350
Fully furnished Pearl point condo di jln klang lama,Old Klang Road,1045,1 700
"The Forum , Jalan TUN Razak , IMBI , MRT , KL , Bukit Bintang",KL City,1180,2 050
"Prima Midah Height , HUKM , Taman MIDAH , Cheras",Cheras,1500,1 600
Majestic Maxim,Cheras,850,1 298
Enesta Condo 3min Walking To Mrt Jinjang Beside Jalan Kepong,Kepong,1429,2 500
Nova 2 Apartment Next Plaza Arkadia Desa Park City,Segambut,933,1 000
"Ppa1m unit , bukit jalil , near LRT",Bukit Jalil,1200,1 200
KepongMas Residences near MRT LRT for rent,Kepong,800,1 000
PV10 PV 10 Condo Fully Aircond Corner Unit Lake View Setapak,Setapak,1272,1 800
"Dorchester Apartment @ Sri Hartamas, Kuala Lumpur Studio for RENT",Sri Hartamas,410,1 200
"Nusa Mewah Apartment , Cheras , For Rent",Cheras,865,1 200
"Anjali @ North Kiara, Segambut Good Condition Unit",Segambut,1316,3 200
Bayu pandan jaya condo,Pandan Jaya,1050,1 800
"WTL : Seri Puteri Condo @ Taman Ikan Emas | Cheras, KL",Cheras,1090,1 700
"Savio Riana Dutamas Residence @ Segambut, Kuala Lumpur Condo for RENT",Segambut,1000,1 500
"New Unit With Aircond, Kitchen Cabinet, Fridge, Washing Machine",Setapak,1000,2 200
"{Ground/F} 1B Pinang Apartment Taman Sri Sentosa , Old Klang Road",Old Klang Road,850,1 300
"Ixora Apartment, Wangsa Permai Kepong, Baisc Unit, Well Kept",Kepong,1035,950
"Unio Residence Kepong, The Era, Savio Riana Dutamas",Kepong,866,1 699
Majestic Maxim New Condo MRT Connaught Cheras UCSI 2 Room,Cheras,650,1 300
Angkasa Condo Cheras Taman Connaught UCSI Free WIFI Alam Damai Len Sen,Cheras,920,1 799
"The Era, Savio Riana DutaMas, Mont kiara",Segambut,893,1 800
Union Heights Condo @ Old Klang Road [P/FURNISHED] 3R2B NICE UNIT,Old Klang Road,1340,1 500
Ativo Suites Residence @ Bandar Sri Damansara,Sri Damansara,607,2 600
"Lido Residence, Cheras, 2rooms, Partly Furnish, MRT Taman Pertama",Cheras,950,1 800
Sky Awani 3 Setapak Genting Kelang 3R2B F/F Tarc College Kuala Lumpur,Setapak,800,1 800
Kenwingston Platz Unit For Rent,Setapak,808,1 600
28 BLVD Cheras Pandan Perdana Studio Shamelin Maluri Indah Jaya Ampang,Pandan Perdana,450,1 599
Anjali north mont kiara penthouse with private lift,Segambut,3713,5 500
"Newly Renovated at Friendly Neighborhood Seri Anggun Condo, Jln Ipoh",Jalan Ipoh,969,1 500
Inspirasi Mont Kiara Great Location New Unit Near Solaris Publika,Mont Kiara,940,3 000
"Winner Court A , Desa Petaling, Kuala Lumpur",Desa Petaling,900,1 150
Flat Pandan Perdana,Ampang,650,800
Taman Desa Cheras Flat Bandar Damai Perdana Cheras For Rent,Cheras,650,750
Maxim aparment for rent ,Cheras,819,1 000
Majestic Maxim Cheras Connaught Leisure Mall Eko KL AREA🚶7min to MRT,Cheras,850,970
Sutera Maya 4b2b2cp Old Klang Road Jalan Puchong Oug Midvalley,Old Klang Road,1341,1 700
"Hipster condo, taman desa [ PENTHOUSE+ID FULLY FURNISHED ]",Taman Desa,1900,3 999
Cheras new building for rent,Cheras,819,1 000
RUMAH SEWA 98% FURNISHED🔥 1 Sentul Condo |1090sf|3R2B|Sentul|NICE 🔥,Sentul,1090,1 599
ANSURAN DEPOSIT KITCHEN CABINET Bayu Tasik 1 Bandar Sri Permaisuri KL,Cheras,926,1 350
(Renovated)(Partially/F) Petaling Indah Condo Sri Petaling Sg Besi KL,Sri Petaling,888,999
Warisan Cityview / near Sunway Velocity,Cheras,1050,1 600
"Residensi Gembira 737, Full Furnished, Kuchai lama, Old klang road",Old Klang Road,850,1 800
"Aster Green, Stove&hood, Fridge&washer, Full aircon, Curtain, Wardrobe",Sri Petaling,861,1 890
"Leafz condo, sungai besi kuchai lama [ PENTHOUSE+DUPLEX ]",Sungai Besi,1400,2 800
Fully Furnished Unit Shuttle To Lrt Nearby Food & Grocery 10min KLCC,Wangsa Maju,800,1 750
DIRECT OWNER🔵POOL VIEW🔵Tiara Faber Condominium Taman Desa Kuala Lumpur,Taman Desa,1200,1 400
Genting Court RENT,Setapak,657,1 100
[ PARTIAL FURNISHED ] MUTIARA FADASON FLAT | Kepong | Jinjang,Jinjang,650,700
【 吉屋出租 】 MUTIARA FADASON |手快有，手慢无 | Kepong | Jinjang,Kepong,650,750
Abadi Indah antique wooden look 3B2b partially furnished,Old Klang Road,980,1 500
PPA1M @ Bukit Jalil [P/FURNISHED] 3R2B NICE UNIT NEAR LRT PAVILION 2,Bukit Jalil,1200,1 200
Flat Taman Sri Bahtera@ Cheras -RENT,Cheras,603,700
"Seri Cempaka at PGRM, Cheras for rent",Cheras,1000,2 000
Endah Regal CONDO for Rent ( Available NOW !! ),Sri Petaling,1141,1 500
Residensi Sefina Mont Kiara 3R2B2CP F/F Hartamas KL,Mont Kiara,1333,4 000
Apartment Pantai Permai,Bangsar South,900,1 200
Sri Desa Condo at Kuchai Lama for rent,Kuchai Lama,970,1 500
Penthouse Suasana Lumayan Condo Bandar Sri Permaisuri Cheras,Cheras,2009,3 800
"28 Boulevard Studio with balcony, Pandan Perdana, Fully Furnished",Pandan Perdana,450,1 700
M City Condo Duplex Unit Jalan Ampang KL,KL City,1804,6 000
"Near Lrt Station 650m walking distance, 4 room, Corner, Vista Angkasa",Bangsar South,1095,2 200
PartlyFurnished✅ Residensi Seri Wahyu Jalan Kuching AC|WaterHeater,KL City,805,1 300
"3 min Walk to Pavilion Bukit Jalil, The Park 2, High Floor, Air Cond",Bukit Jalil,750,2 400
"F/F Kepong Sentral Condominium, Jalan Puncak Desa 2, Taman Puncak",Kepong,1050,1 800
Kepong Fortune Park Mizumi Residence Actual Photos Best Price,Kepong,1027,1 400
South Link Apartment Bangsar South KL Gateaway,Bangsar South,495,2 000
"Union Heights Condo, OUG Oversea United Garden, Taman Yarl (1340sf)",Old Klang Road,1340,1 600
Majestic Maxim 2 Rooms for RENT (~with nice Partial Furnish),Cheras,650,1 550
"Amaya Serviced Residence, Taman Maluri, Fully Furnished For Rent",Cheras,920,2 500
The Scott Soho Old Klang Road Kuala Lumpur 1r2b F/F Duplex (Cheapest),Old Klang Road,775,1 600
[ PARTIAL FURNISHED ] MIZUMI RESIDENCE | Facing Pool | Kepong,Kepong,932,1 800
[fully furnished] [2 car parks] move in condition Sky Awani 3,Setapak,800,2 000
"Aster green condo, sri petaling kuchai lama [ BRAND NEW+READY MOVE IN]",Sri Petaling,700,1 500
"D'nuri Residence Brand New Unit nr Desa Petaling, KL",Desa Petaling,850,1 300
Residensi desa satumas for rent,Taman Desa,850,1 250
"Vista Komanwel B,Fully Furnished near International Medical University",Bukit Jalil,1421,1 800
"288 residency , 1408sf , 3r3b , f/furnished , setapak",Setapak,1408,2 500
"M Centura , 850sf , 3r2b , p/furnished , sentul",Sentul,850,1 750
"The reach , 1441sf , 3r3b , basic , titiwangsa , setapak",Setapak,1441,2 800
Cheras Connaught Avenue,Cheras,950,1 300
ANSURAN DEPOSIT FURNISHED Sri Pelangi Condominium Setapak Wangsa Maju,Setapak,980,1 350
"Seri Cempaka @ PGRM, Cheras for rent",Cheras,566,1 250
ANSURAN DEPOSIT FURNISHED PPA1M Bukit Jalil Kuala Lumpur,Bukit Jalil,1200,1 300
Menara Menjalara Kepong,Bandar Menjalara,1000,1 400
Majestic Maxim Brand New Ready Move In walk to MRT Cheras,Cheras,819,1 500
PV 2 house for rent,Setapak,1450,1 500
"Pinnacle condo, sri petaling happy garden [ FULLY FURNISHED+3ROOM ]",Sri Petaling,910,2 200
The Loft Zetapark Setapak 3R2B2CP P/F Central Mall Danau Kota PV,Setapak,1080,1 850
Residensi Pandanmas 1 Kampung Pandan 3R2B 70%Furnished Near KLCC,Desa Pandan,900,1 550
"Aman Dua Apartment , Kepong",Kepong,850,1 000
Maxim cheras len sen UCSI ,Cheras,819,1 000
"3 Towers Suite, Jln Ampang KL City Centre, Fully Furnished",KL City,885,1 600
"Pinnalce sri petaling, sri petaling happy garden [ 2ROOM+FULL FURNISH]",Sri Petaling,861,1 988
The Birch Jalan Ipoh Kuala Lumpur 2r2b F/F (cheapest),Jalan Ipoh,700,2 200
Sri Desa Condo at Kuchai Lama for rent,Kuchai Lama,960,1 350
Condo Rent 2 Carpark OUG Parklane 950sf 3room Puchong near LRT,OUG,950,1 350
One 1 Sentul 3R2B2CP F/F Sentul Pasar Point Sky Awani Batu Muda,Sentul,1081,1 800
Majestic Maxim Cheras Kuala Lumpur nearby Leisure mall,Cheras,819,1 000
"M Centura Sentul,near One Maxim,Maxim Citylights,Sentul Point,Skyawani",Sentul,646,1 300
"V Residence Suites @ Sunway Velocity , Cheras, Kuala Lumpur",Cheras,695,2 300
Ketumbar Hill Condo Fully Furnished Taman Cheras Yulek Leisure Mall,Cheras,1200,1 400
"Actual unit! United Point Residence, North Kiara Partly for Rent!",Kepong,958,1 700
"Prima setapak condo , 1231sf , 3r2b , p/furnished , Setapak",Setapak,1231,1 600
Condo Rent Residensi Gembira 737 Happy Garden 850sf OKR Kuchai Lama,Old Klang Road,850,2 000
"Aster Green, Brand new F/F unit Below Market, ReadyView&MoveIn anytime",Sri Petaling,657,1 650
"Sky Awani 3, Setapak [BEST DEAL] [3R2BR] [1CARPARK]",Setapak,800,1 250
Scott Garden Old Klang Road 1R2B FF Mid Valley Bangsar Pantai Kerinchi,Old Klang Road,775,1 550
Plaza Medan Putra Avelon Tower Menjalara Kepong Unit For Rent❤ Hot ✔,Bandar Menjalara,958,1 200
"Eco Sky 3R2B, Kepong, Fully Furnished Selayang Lotus KTM Taman Wahyu",Jalan Ipoh,1109,2 250
Kenwingston Avenue Fully Furnished,Sungai Besi,860,1 700
"Paraiso condo, bukit jalil city pavilion 2 [ CORNER LOT+FULLY FURNISH]",Bukit Jalil,1300,2 900
"Majestic Maxim, Cheras [3R2BR] [1 CARPARK]",Cheras,810,1 350
Union Heights Old Klang Road Kuala Lumpur 3r2b P/F (cheapest),Old Klang Road,1340,1 600
28 Boulevard Ampang Fully Furnish For Rent！,Pandan Perdana,450,1 650
"Bayu Sentul Condo,Sentul near Jalan Ipoh,Sentul Point,Skyawani,Maxim",Sentul,1230,1 550
Suria Kipark Damansara Kepong Fully Funished For Rent [ Limited ] ❤💕❤,Kepong,948,1 200
"Paraiso residence, bukit jalil city pavilion 2 [ BRAND NEW+ID DESIGN ]",Bukit Jalil,1000,2 400
"The havre condo, bukit jalil city pavilion 2 [FULLY FURNISHED+BALCONY]",Bukit Jalil,1100,2 388
NEWLY PAINTED and RENOVATED Pudu Impian 1 with LIFT near LRT/MRT,Cheras,700,1 300
Desa Pandan Pandanmas 2 Condo,Desa Pandan,900,1 600
Aprt for rent,Setapak,250,1 500
Bayu Andaman Sentul Kuala Lumpur 3r2b P/F (cheapest),Sentul,1000,1 400
Kiaraville Mont Kiara Kuala Lumpur 3r3b F/F (Cheapest),Mont Kiara,1593,4 500
|DUPLEX| Fully Furnished Teratai Mewah Condominium @ Setapak,Setapak,1400,2 000
"The havre condo, bukit jalil city pavilion 2 [ CORNER LOT+BIGGER SIZE]",Bukit Jalil,1300,1 880
"Platinum Splendor , Fully Renovation !!",Keramat,1180,1 900
Majestic maxim cheras taman segar perdana near MRT leisure mall,Cheras,820,1 000
Sri Penara Apartment Sri Permaisuri Cheras 3R2B LRT Salak Selatan HUKM,Cheras,650,950
Majestic maxim cheras taman maluri near to MRT Aeon maluri,Cheras,820,1 000
The Elements Ampang Condo Jalan Ampang KL,Ampang,705,1 500
South Link semi furnished,Bangsar South,592,1 700
Putra Suria Residensi at Bandar Sri Permaisuri with Air Cond,Cheras,753,1 350
PV13 Condo for rent near Taruc Setapak Kuala Lumpur,Setapak,1313,1 800
"[Rent]Impiana Sky Residence,Pavillion Bukit jalil,8min Lrt Muhibbah",Bukit Jalil,860,1 350
Endah Puri Condo,Sri Petaling,1216,600
"Actual unit! United Point Residence, North Kiara for Rent!",Kepong,958,1 700
For Rent Irama Wangsa Condominium Wangsa Maju Kuala Lumpur,Wangsa Maju,1335,2 800
Platinum Teratai Condo Fully Furnished Setapak Danau Kota Depo Nego,Setapak,928,1 900
Platinum Splendor Fully Furnished,Keramat,1180,2 400
"Savio Riana Dutamas, Actual Fully Furnished new unit (Owner)",Segambut,653,1 650
"Ketumbar Height Condo,Leisuremall,Eko Cheras,6min to MRT Tmn Mutiara",Cheras,760,950
"[High Floor] Vista Mutiara Condo, Kepong For Rent",Kepong,1211,1 300
Majestic Maxim Cheras Kuala Lumpur Balakong nearby UCSI UNIVERSITY,Cheras,819,1 000
"[Rent]Sri Jati 2 Condominium, Old Klang Road, Kuala Lumpur,3r2b",Old Klang Road,1210,1 300
Reizz Residence Fully/F Jalan Ampang Hilir Ampang Point KLCC Elements,Ampang Hilir,860,2 300
Ketumbar hts Klcc/pool view-leisure mall / ekocheras,Cheras,755,1 000
I-Zen Kiara 2 Premium Condominium For Rent :),Mont Kiara,1365,4 000
pantai hilllpark phase 5,Bangsar South,1000,1 500
The REACH @ Titiwangsa,Setapak,1523,3 200
Majestic Maxim Cheras Connaught Leisure Mall Eko Cheras 🚶7min to MRT,Cheras,850,971
Sky Awani 1 below Market Price,Sentul,800,1 400
Season Garden 3R2B Sri Rampai Lrt Setapak Wisma FELCRA Wangsa Walk KL,Wangsa Maju,770,1 299
"Amaya Maluri Cheras (walk to LRT Maluri, AEON and Banks)",Cheras,920,2 200
Maytower Studio Unit KL City Centre,KL City,351,1 400
Union heights condominium for rent,Old Klang Road,1340,1 600
Arena Green Apartment 2r2b Bukit Jalil,Bukit Jalil,786,1 250
TWY MONT KIARA ! Fully Furnished ! NICE House!,Mont Kiara,656,2 500
Mawar Sari Apartment AU3 Keramat Setiawangsa [PARTIALLY FURNISHED],Keramat,950,1 500
"Mont Kiara Palma, F/Furnished Condominium",Mont Kiara,1280,3 100
Majestic Maxim Cheras Connaught Leisure Mall Eko Cheras 🚶7min to MRT,Cheras,850,972
Jalan Ipoh condo near KL,Jalan Ipoh,1000,1 400
Casaria Apartment Taman Maluri Cheras KL,Cheras,1050,2 000
38 Bidara Condomium Bukit Bintang,KLCC,900,2 200
Fully Furnished Corner Unit Parkhill Residence Bukit Jalil near APU,Bukit Jalil,1300,2 800
setapak wangsa maju section 4 flat first floor,Wangsa Maju,650,850
diamond residence newly painted condo at setapak,Setapak,1100,1 500
Majestic maxim cheras taman Suntex near to MRT nsk cheras,Cheras,820,1 000
38 Bidara Condo F/Furnished 2BedBath KL City Centre Pavillion KL MRT,KLCC,750,2 000
"Seasons Garden Residences, Wangsa Maju",Wangsa Maju,779,1 500
The Reach @ Titiwangsa [ Specialist ] BELOW MARKET !!!,Setapak,1524,3 499
"Aster Green, Stove&hood, Fridge&washer, Full Aircon, ReadyView&MoveIn",Sri Petaling,657,1 600
Majestic maxim cheras pandan jaya near to shamelin mall,Cheras,820,1 000
"Nusa Mewah Condo, Partially Furnish, Taman Bukit Pandan, Cheras (Nego)",Cheras,865,1 200
3 Rooms Cheras Permaisuri BAYU TASIK 1 Condo nr JPJ & LRT SALAK SOUTH,Cheras,920,1 200
KL City Jalan Ipoh Sentul New Condo,Jalan Ipoh,668,1 800
OUG Parklane Apt/Partially Furnished/1 Car Park/OUG/Old Klang Road/OUG,OUG,950,1 000
M Centura Sentul KLCC (2 Car Park) Fully Furnish & Partially Furnish,Sentul,850,1 400
"Seri Maya Condo F/Furnished Taman Setiawangsa, jelatek, Near LRT",Setiawangsa,1184,2 500
rampai court furnish apartment at sri rampai setapak,Wangsa Maju,650,1 200
bukit pandan 2 condominium pandan perdana cheras shamelin maluri lrt,Cheras,1200,1 250
united point condominium for rent,Kepong,958,2 500
Beside Hospital Ampang. Just opposite.,Ampang,850,1 400
Eco Sky Clarity Tower/Fully Furnished/Ready/1087sf/Facing KL,Jalan Ipoh,1087,2 400
Low Rent Cheras Permaisuri CEMARA Apartment nr SALAK SELATAN LRT,Cheras,750,1 000
ECO Budget Apt I Low Depo,Bangsar South,850,1 200
"Southbank Residence, Old Klang Road (Free WIFI + Welcome COA)",Old Klang Road,779,2 500
Condominium Sentul Utama For Rent,Sentul,877,1 350
Last unit 1b1b Fully Harmoni 1 near Mont Kiara Publika Solaris,Segambut,390,1 400
Last unit 1b1b Fully Harmoni 1 near Mont Kiara Publika Solaris,Segambut,390,1 400
3 minutes walk to CAHAYA LRT CHERAS PANDAN CAHAYA Shop Apartment,Ampang,650,680
sentul point 850sf 3r2b partial 2aircond /ready move facing mont kiara,Sentul,850,1 600
Sky Awani 3 Setapak Fully furnish unit for RENT !! Ready for Move in,Sentul,800,2 000
Lavile Kuala Lumpur,Cheras,750,2 800
"2r2b, near to lalaport, times square, fully furnished, bukit bintang",Bukit Bintang,740,2 100
"Move anytime, Fully furnish unit in M Centura Sentul, near LRT MRT HKL",Sentul,850,1 400
UBN Tower KL Golden Triangle,KL City,720,2 100
Newly refurbished 3bedrooms 3baths,Bangsar,1700,3 200
Near LRT Setiawangsa Seri Maya Condominium Jalan Jelatek Kuala Lumpur,Setiawangsa,1108,2 400
Segambut Villa Crystal 3R2B,Segambut,1400,1 800
"Apartment Aman Putra, Kepong, Jinjang, Near MRT, Kuala Lumpur",Kepong,750,750
"SingleBedroom, Menara Duta 2, Mont Kiara, Female Only (Full Furnished)",Segambut,1450,420
[FOR RENT] SAVILLE MELAWATI|3bed|serini|gaya melawati|3residen|the veo,Taman Melawati,1009,1 600
1A Stonor 850sf 2BR Furnished Walking to Pavilion KL,KLCC,850,2 800
MH Platinum Setapak Condo Unit For Rent,Setapak,682,1 300
Rumah Untuk Disewa ( KEMASUKAN SEGERA),Sentul,850,2 800
Partial Furnished Unit (Below Market Rate) @ Paraiso Residence,Bukit Jalil,1101,1 800
Built in wardrobe Fully furnished Unit For Rent @ Paraiso Residence,Bukit Jalil,1101,2 650
Corner Unit at Covillea Bukit Jalil for Rent,Bukit Jalil,1415,3 500
"(Murah) BAM Villa Condo at Taman Maluri, Cheras",Cheras,936,1 200
"Newly painted & Big layout | Apartment Zamrud, Jalan Klang Lama, KL",Old Klang Road,1170,1 200
3 Towers Studio Furnished 423sf Jalan Ampang KL,KL City,423,1 500
Bayu Tasik 1 Condo Permaisuri Salak Selatan Cheras LRT HUKM New Paint,Cheras,900,1 350
"Vina Residency, Cloudtree, Damai hillpark, Alam Damai, tun hussein onn",Cheras,1550,1 200
Fully Aircons KL Traders Square Jalan Gombak Kuala Lumpur,Gombak,1059,1 650
"Shamelin Bestari, Shamelin, Cheras, near to school, Renovated, Maluri",Cheras,1060,1 700
Endah RIa Sri Petaling 3R2B FF Endah Parade Endah Regal APU KL IMU,Sri Petaling,946,1 400
"STUNNING VIEW!! Setia Sky Residence, FURNISHED at KL",KLCC,1050,2 900
"Hijauan Lumayan, 3r2b2cp, Partially Furnished, Renovated Unit Near MRT",Sungai Besi,1035,1 400
NEGOTIABLE 10 Semantan Studio Damansara Heights Fully Furnish,Damansara Heights,510,1 350
"Residensi Kepongmas, Kuala Lumpur, Mizumi, MRT, Aeon, Kepong, Enesta",Kepong,800,1 000
Sri Intan 2 CONDO Jalan Ipoh KUALA LUMPUR NEAR KEPONG,Jalan Ipoh,1221,1 500
"Titiwangsa Sentral,Fully Furnished 3 Rooms, Near to Lrt/Monorail Hlk",Titiwangsa,1100,2 400
PV 9 New condo in Setapak fully furnished unit for rent(Below Market),Setapak,1000,2 200
UNIO residence kepong brand new unit for RENT !!! Actual Unit,Kepong,866,2 100
Unio Residence Below Market Partially Furnished For Rent! Actual Unit!,Kepong,866,1 800
PV 9 In Setapak Studio Unit For Rent (Fully Furnished),Setapak,400,1 500
"(Want To Let) Altitude 236 Condominium Alam Damai,56000 Cheras",Cheras,1808,3 000
"Residensi Majestic Maxim, Cheras for Rent",Cheras,650,1 600
(Want To Let) Widuri Impian Condominium Taman Desa Petaling,Desa Petaling,960,1 350
Actual Unit KepongMas Kuala Lumpur Sri Hartamas Plaza Arkadia MRR2,Kepong,800,999
Cintai Condominium Rental Jalan U Thant,Ampang Hilir,4769,12 000
KepongMas |Segambut | Batu Caves |Lotu's Selayang Actual Unit with2 CP,Kepong,800,1 345
NEGO FULL FURNISH Dorchester Studio Sri Hartamas BESIDE MALL,Sri Hartamas,410,1 250
"325 Ritchie (C1, Low Density Duplex)",Ampang Hilir,4300,12 000
Near LRT Stunning View One Jelatek Condominium @ Jln Jelatek for Rent,Setiawangsa,1327,2 800
Damai Hillpark Condominium At Alam Damai Cheras For Rent!,Bandar Damai Perdana,1020,1 500
"Abadi Villa Condo Taman Desa, 3 Rooms, Basic Unit, Midvalley, Bas Stop",Taman Desa,1100,1 200
Wangsa Maju Section 2 Apartment - 3bedrooms 2bathrooms - near LRT,Wangsa Maju,700,1 000
PV9 Setapak Fully Furnish unit for RENT ! 3 Room with 2 Parking,Setapak,1000,2 200
M Centura Partially Furnished For Rent (2 carpark),Sentul,850,1 650
Sky Awani 1 In Sentul For Rent(with fridge and washing machine),Sentul,800,1 350
[Must View] PPA1M near Bukit Jalil Stadium & LRT,Bukit Jalil,1200,1 000
Dutaria for rent,Solaris Dutamas,1325,2 000
Ready To Move In Setia Sky Residence Fully Furnished,KLCC,1050,2 900
[FULLY FURNISHED] Residensi Platinum Teratai Setapak,Setapak,928,1 900
"FOR RENT: Vista Wirajaya 2, PV9, Setapak",Setapak,850,1 700
Pandan perdana flat untuk disewa,Ampang,603,750
The Sky Residence Shamelin Perkasa KUPTM,Cheras,668,1 700
Fully Furnished Balcony Room,Titiwangsa,850,850
Fully Furnished Room for 1pax,Bukit Jalil,1023,650
Putra Villa Condominium - Walking distance LRT Taman Melati,Setapak,1075,1 600
Fully furnished Pantai Hillpark - Bangsar South,Bangsar South,1020,2 000
UNIT CANTIK Residensi Pandanmas 2 WITH KITCHEN CABINET,Desa Pandan,900,1 600
Season Garden Residence @Wangsa Maju @Setapak,Wangsa Maju,700,1 500
Season Garden Wangsa Maju Many Unit Available For Rent,Wangsa Maju,770,1 800
Bougainvilla Condo Bukit Prima Pelangi Segambut 1100sf 3r2b Semi Furni,Segambut,1100,1 400
"[Must view] PV6 PV 6 condo 1328sf , 4r2b,kitchen cabinet, taman melati",Setapak,1328,1 600
"Maxim residences, len seng, taman connaught,",Cheras,680,1 200
Arte Plus Ampang (RENOVATED ID DESIGN F/F HIGH FLOOR NICE VIEW),Ampang,800,2 000
Pavilion Hilltop Mont Kiara (RENOVATED FULLY FURNISHED KLCC VIEW),Mont Kiara,1200,4 800
Agile Mont Kiara (RENOVATED ID DESIGN F/F HIGH FLOOR UNBLOCKED VIEW),Mont Kiara,2056,9 000
"Mid Floor, Newly Furbished Seri Raja Chulan",Bukit Bintang,1488,3 500
Astana Lumayan Well Maintained 4 Bedrooms @ Bandar Sri Permaisuri,Cheras,1207,1 700
Fortune Perdana High Floor with Lakeside View,Kepong,1158,2 000
Fully Furnished Renovated Sentul Point Kuala Lumpur,Sentul,900,2 800
Fortune Perdana Condominium with Lakeview for rent,Kepong,1296,2 300
"[MODERN ID] United Point, Segambut (Actual Unit - Furnished)",Kepong,958,2 400
"[MODERN ID] Tuan Residency, Jalan Kuching (Actual Unit - Furnished)",Jalan Kuching,898,2 200
10 Semantan Studio ~ Damansara Heights,Damansara Heights,520,1 500
Sri Rakyat Apartment Bukit Jalil,Bukit Jalil,700,900
Kepong Desa Aman Puri Aman Dua Apartment Corner Unit For Rent,Kepong,850,1 100
Freehold,Kepong,650,600
Anggunpuri for rent,Segambut,1000,1 400
"Cheras Taman Bukit Pandan Shop Apartment Jln Kuari, Kg Cheras Baru",Cheras,650,700
CHEAPEST Sri Pelangi Condo Setapak 3R2B 980SQFT,Setapak,980,1 400
Enesta Kepong condo walking distance to MRT,Kepong,850,1 500
Residensi Razakmas 2 Bandar Tun Razak,Cheras,805,1 300
CHEAPEST Sentul Point Condo 3R2B 850SQFT Fully Furnish,Sentul,850,2 800
"Taman Cantik Apartment At Pertama Cheras , Kuala Lumpur",Cheras,1300,1 300
Sri pelangi condo jalan genting klang setapak,Setapak,950,1 300
"Southview, Bangsar South, fully furnished 5mins walk to KL Gateway LRT",Bangsar South,700,2 500
Sri Putramas 1 Condo Few Unit Available,Jalan Kuching,1050,1 500
The Ridge at KL East Mall Taman Melati Setapak K.L,Ampang,651,1 400
Menara Avenue KLCC Partly Furnish For Rent Well Kept,KLCC,1679,3 500
"The Hamstead, Have Few Unit To View nearby lrt / cheras ",Cheras,950,1 500
"3R2B M Centura, Sentul LRT MRT, Gombak Free WIFI Premium facilities",Sentul,850,1 800
"Maxim Citylights 2R2B, Sentul, Furnished 5mins MRT LRT Move in Mid Apr",Sentul,860,1 500
Desa Gembira in Taman Gembira,Old Klang Road,1257,1 500
Taman Metro Perdana timur Apartment NEW PAINT TOYOTA KEPONG,Kepong,1000,1 000
"SUITE ENESTA Residence Kepong JINJANG ,UNIO MRT METRO PRIMA",Kepong,1009,1 600
SUITE ENESTA Residence 3ROOM 2BATH Kepong NICE VIEW JINJANG UNIO MRT,Kepong,980,1 550
Ixora Apartment @ Wangsa Permai Kepong,Kepong,903,950
Dual Key Mini Studio 800m Jelatek LRT 4 Station Ampang Point TRX,Ampang,280,1 100
"Prima Court, Taman Melawati",Ampang,850,1 499
"20trees Apartment, 20 trees, Taman Melawati",Taman Melawati,1958,3 599
