[Studio Unit] Scarletz Suites @ KL City Centre,KLCC,450,3 500
Awana Puri Condominium at CherasShort Walk MRT Leisure Mall Eko Cheras,Cheras,1100,1 400
Maxim majestic brand new 2023 near MRT,Cheras,819,1 000
Menara Duta Condo Partly Furnish 10th floor Nice View,Solaris Dutamas,1500,2 150
Lavile Service Residence Jalan Jejaka MRT LRT Mid Floor,Cheras,750,2 999
UNA Service Residence 2 Rooms MRT LRT Velocity AEON Jusco Nice View,Cheras,810,3 300
Casa Mutiara to Bukit Bintang KLCC 10mins driving,Bukit Bintang,750,2 300
Exclusive Condominium M City Jalan Ampang Balcony Facing KLCC,KL City,900,2 100
"Bukit jalil, Kiara Residence 2, Walking Distance to LRT station",Bukit Jalil,1258,2 100
"Jalilmas Bukit Jalil>LRT, ,Lanai,PPA1M,Impiana Sky, Platinum Oug",Kuchai Lama,800,1 000
Residensi Jalilmas Bukit Jalil LRT Awan Besar,Bukit Jalil,800,1 000
Residensi Jalilmas Bukit Jalil LRT Awan Besar,Bukit Jalil,800,850
Fully Furnish Tiata Mutiara 2 For Rent,Old Klang Road,1000,1 800
SEMI FURNISHED😍 *VACANT* One Maxim M Centura Sentul Point,Sentul,850,1 699
"Savio Riana Dutamas Residence, Actual, Part/Furnished, Move In Ready",Segambut,653,1 500
"[April Move In] Sri Rampai Hedgeford 10 , Fully Furnish , Below Market",Wangsa Maju,620,1 300
Dekat Lrt Cempaka! Nuri Court Pandan Indah Ampang,Pandan Indah,850,1 000
Good For Own Stay Cheap Nusa Mewah Condo at Cheras,Cheras,850,1 100
Vyne condo partial,Sungai Besi,1106,1 800
"(Rumah sewa) OUG Parklane Condominium, Jalan klang Lama, near LRT",OUG,950,1 350
Majestic Maxim Cheras Ampang Kajang Bukit Jalil Cyberjaya near MRT,Cheras,820,1 000
"Segambut Bougainvilla Apartment, Partly furnished renovated",Segambut,1162,1 500
"Cheras Maluri Lavile KL Condo, 2 carpark fully furnished Kl View",Cheras,864,2 800
"Apartment Tmn Kuchai Jaya, Walking distance to Sekolah sentosa",Kuchai Lama,600,850
Vantage Point Condo Desa Petaling,Desa Petaling,886,1 250
"Laville condo near Aeon maluri Cheras, 3 rooms",Cheras,962,3 150
"PV18 Setapak Condo, ready to move in!",Setapak,1021,1 500
Cheras: Flat Kos Rendah Bandar Tasik Selatan,Bandar Tasik Selatan,657,800
"South View Serviced Apartments, Fully Furnished 2 Car park",Bangsar South,648,2 400
"Seri Puri condo, Aman Puri Kepong",Kepong,1000,1 200
"Zero deposit, Citizen Old Klang Road 3 Bedrooms",Old Klang Road,883,2 400
SEMI FURNISHED🔵MURAHX3🔵Faber Tiara Condominium Taman Desa KL,Taman Desa,1200,1 400
Splendor Semarak KLCC Sri Rampai 3R2B Kitchen Cabinet Air Cond MINDEF,Keramat,1000,1 800
Splendor Semarak KLCC Keramat Sri Rampai Semi/Fully Furnish Ready View,Keramat,926,1 600
Lakeville Residence BIG Unit For RENT!!! Facing Lake VIEW,Jalan Ipoh,1234,2 300
Cheras Hartamas Majestic Maxim Nr MRT Len Sen Connaught UCSI EkoCheras,Cheras,819,1 600
"Casa Residency, Bukit Bintang near LRT/Monorail",Bukit Bintang,1060,3 300
"Pv9, Taman Melati -Fully Furnished ready to move in",Setapak,1100,2 500
Partially Furnish Cheras M Vertica Nr LRT MRT Maluri Taman Pertama,Cheras,1000,2 500
Nice RENT SKY MERIDIEN Sentul,Sentul,950,2 800
Apartment For Rent (Shoplot Apartment) Taman Desa Cheras For Rent,Cheras,665,800
Eco Sky 3 Rooms Fully Jalan Kuching ,Jalan Kuching,1050,2 000
Eco Sky Fully With Balcony Jalan Kuching Id Design,Jalan Kuching,904,1 900
Eco Sky Fully With Balcony Jalan Kuching Id Design ,Jalan Kuching,904,1 700
Eco Sky Fully With Balcony Jalan Kuching Id Design,Jalan Kuching,904,1 600
Eco Sky Fully With Balcony Jalan Kuching Id Design,Jalan Kuching,860,1 600
"Welcome Viewing ,walking distance to Lrt",Bangsar South,650,2 400
Residensi Platinum Teratai | Setapak | KL | Nearby LRT,Setapak,928,1 900
NEAR HKL IJN Bayu Andaman Residence Sentul,Sentul,1000,1 400
Eco Sky Fully With Balcony Jalan Kuching Id Design,Jalan Kuching,904,2 000
Maxim majestic near mid valley cheras walking mrt 10min,Cheras,819,1 000
Maxim majestic new 2023 taman lensen connuaght,Cheras,819,1 000
Dahlia Apartment Setapak Sri Rampai SEWA MURAH+WELL KEPT Near LRT AEON,Setapak,850,1 148
Tuan Residency Jalan Kuching CHEAPEST+COZY GOOD VIEW+DEMAND Near Duke,Jalan Kuching,878,1 648
The Era Residence Segambut CHEAPEST+GOOD VIEW+2 PARKING Near Publika,Segambut,893,1 698
"Walking Distance to LRT @ Putra Suria Residensi, Cheras, KL",Cheras,750,1 200
"Residensi Vista Wirajaya, Setapak untuk disewa",Setapak,883,1 450
"[FULLY FURNISHED] PV 10 CONDOMINIUM, SETAPAK [MUSLIM FAMILY Only]",Setapak,1200,1 700
CANTIK !! Rumah atas Setapak Central Mall ingin disewa !!,Setapak,1281,2 500
"Season Garden Residence, Wangsa Maju",Wangsa Maju,890,1 700
"Wisma Mutiara Office , jalan loke yew, sungai besi, Pudu, Cheras, KL",KL City,1800,1 999
Seasons Garden Residence Fully Furnish 3R2B wit Parking [NICE & CLEAN],Wangsa Maju,770,1 900
Residensi Pandanmas (Cheras/KL/Ampang),Desa Pandan,900,1 600
Ixora Apartment [ HOT DEAL ] Taman Wangsa Permai Kepong Selayang,Kepong,970,900
Cheras Ampang Bkt Permai Monte Bayu Nr Pandan Putra Indah Kencana,Cheras,865,1 300
[ Cheapest ] OUG Parklane Old Klang Road Mid Valley KL Sentral Sunway,OUG,950,1 000
[ Cheap Unit ] Monte Bayu Ampang Cheras Bukit Pandan Kampung Baru,Cheras,835,1 100
Cheras Majestic Maxim Nr MRT Len Sen EkoCheras Connaught UCSI TBS,Cheras,650,1 700
Cheras Mewah Court Nr CS Tun Perak Len Sen C180 Alam Damai Sg Besi,Cheras,900,980
Cheras Hartamas Segar Jaya The Mark Nr MRT Mutiara EkoCheras Connaught,Cheras,1166,2 300
Cheras Midah Jasmine Court Nr MRT Pertama Maluri Shamelin Miharja HUKM,Cheras,1285,1 400
Cheras Majestic Maxim Nr MRT Len Sen Mutiara EkoCheras Connaught UCSI,Cheras,819,1 600
Cheras Nr MRT Connaught Majestic Maxim UCSI TBS Taynton EkoCheras,Cheras,819,1 600
Cheras Hartamas Segar Jaya The Mark Nr MRT Mutiara EkoCheras Taynton,Cheras,1166,2 300
Cheras Yulek Ketumbar Hill Nr Pantai Midah Pertama EkoCheras Perdana,Cheras,1200,1 450
Cheras Tun Razak Permaisuri Suasana Lumayan Nr HUKM MRT,Cheras,1147,1 700
Fully Furnished 2r2b @ The elements Jalan Ampang Ulu (Near KLCC),Ampang,1000,2 500
Fully Furnished 2r2b @The elements Jalan Ampang (Near KLCC),Ampang,850,2 200
Fully Furnished 2r2b @ The Reizz Jalan Ampang (Near KLCC),Ampang Hilir,850,2 400
Fully Furnished 3r2b @Residensi Jalan Jubilee (Jalan Loke Yew),KL City,1010,1 600
"Majestic Maxim, Taman 7",Cheras,650,1 000
"Putra Majestik, Jalan Ipoh, Move in anytime",Jalan Ipoh,1015,2 000
For Rent‼️‼️ PV10 Condo Setapak,Setapak,1100,1 700
Platinum Residence OUG Kuchai Lama Sri Petaling OKR Midvaley KL,Old Klang Road,1250,2 400
"1st Floor, Winner Heights Condominium, Desa Petaling, Height",Desa Petaling,830,950
"M-Suite,Manjalara - Fully Furnished ready to move in",Bandar Menjalara,460,1 550
"Sri Pelangi, Setapak - Partially Furnished Corner unit with nice view",Setapak,840,1 250
"Pv5,Setapak - Fully Furnished corner unit with klcc view,ready to move",Setapak,1331,1 999
"Tr Residence,Titiwangsa - Fully Furnished ready to move in",Titiwangsa,710,2 300
"Season Garden, Wangsa maju - Partially Furnished Ready to move in",Wangsa Maju,850,1 550
Desa Satumas Taman Desa Near Kuchai Old Klang Road Abadi,Taman Desa,850,1 000
"Sofiya Residensi,Desapark - Partially Furnished Garden view",Desa ParkCity,862,1 799
"Kl Trader Square,Setapak - Fully Furnished Ready to move in",Gombak,940,2 250
Prisma Cheras Taman Midah near MRT,Cheras,1070,1 600
"Citizen 2 [ Modern Design ] Fully Furnished, Actual unit photos!",Old Klang Road,883,2 700
"D'Sands Residence @ Old Klang Road [ Near By KTM ] Kuchai Lama, KL",Old Klang Road,1048,2 000
Property For Rent Season Garden Wangsa Maju,Wangsa Maju,850,1 600
Majextic Maxim 2R2B,Cheras,640,1 500
Setapak PV 9 Taman Melati Condo Rumah Sewa PV9 Near LRT TARC,Setapak,1000,1 800
"The havre condo, bukit jalil city [ FULLY FURNISHED+BELOW MARKET ]",Bukit Jalil,1100,1 998
Setapak PV 9 Taman Melati Condo Rumah Sewa PV9 Near LRT TARC,Setapak,1000,1 800
"UNIO Residence,Condominium,2B2B,Ready to move in,",Kepong,866,1 800
United Point Residence,Kepong,958,2 400
Kepong The Henge Corner Lot 2CarPark Rumah Sewa Near Metropolitan MRT,Kepong,1300,1 800
[ ID DESIGN ] UNITED POINT Condo | Fully Furnished | Segambut | Kepong,Kepong,958,2 600
28 Boulevard @ Pandan Perdana Big Studio unit w Fully Furnished G.View,Pandan Perdana,450,1 550
For Rent :The Park Sky Residence @ Pavillion Bukit Jalil,Bukit Jalil,868,2 600
"Changkat View Condominium, Sri Hartamas, Kuala Lumpur",Solaris Dutamas,1100,1 700
Rica Residence [ 2Bedroom 2Bathroom ] 2 Parking,Sentul,950,1 800
The Signature Studio Service Residence Sri Hartamas Corner,Sri Hartamas,717,3 000
Vista Damai Condo Jalan Tun Razak KLCC,KL City,920,2 400
"Maxim Residences @ Cheras KL , Cheras, Cheras, Kuala Lumpur",Cheras,850,1 300
"The leafz, sungai besi kuchai lama [ DUPLEX/PENTHOUSE+ID DESIGN ]",Sungai Besi,1400,2 700
Perumahan Pantai Permai Fully Furnished Bangsar South KL,Bangsar South,650,1 200
Kepong Fortune Avenue Condo 2Carpark Rumah Sewa Near MRT AEON Ready,Kepong,1137,1 500
Kepong Ixora Fully Furnish Condo Rumah Sewa Wangsa Permai Ready Unit,Kepong,935,1 250
"The link 2 residence, bukit jalil golf view [ FULLY FURNISH+BALCONY ]",Bukit Jalil,800,1 899
The Hipster for rent @ Taman Desa,Taman Desa,921,1 800
"Taman pusat kepong shop apartment,3B2B,Kitchen cabinet,move in ready",Kepong,998,1 000
"The link 2 residence, bukit jalil city [ CORNER LOT+FULLY FURNISHED ]",Bukit Jalil,1218,2 500
"Zeta Deskye Sentul KL , Batu Caves View,Jalan Ipoh ( Near HKL )",Jalan Ipoh,1037,14 999
"[10 min to MRT!] Shoplot Apartment Taman Desa Cheras, Alam Damai",Cheras,750,800
[Fully Furnished! 100% Good condition] Shoplot Apartment Desa Cheras,Cheras,750,900
"Bayu Tasik Condominium, Bandar Sri Permaisuri, Cheras, Kuala Lumpur",Cheras,920,1 350
"Fully Furnished Studio 28 Boulevard For Rent, Pandan Perdana",Pandan Perdana,450,1 600
Vista Wirajaya 2 Taman Melati Fully Furnish Unit Near KLCC LRT TARC,Setapak,850,2 000
"The hipster condo, taman desa [BRAND NEW+BELOW MARKET ]",Taman Desa,958,1 600
"hermington condo, kuchai lama old klang road [ FULLY FURNISHED ]",Kuchai Lama,1100,2 200
"The leafz condo, sungai besi kuchai lama [ FULLY FURNISHED+KLCC VIEW ]",Sungai Besi,1100,2 200
Kepong PPAM Metropolitan 1500sqft Rumah Sewa Condo Near MRR2 PPA1M,Kepong,1500,1 500
Residence 8 @ Old Klang Road Studio w Fully Furnished High Floor Unit!,Old Klang Road,380,1 000
Majestic Maxim 650 Sqft Cheras Taman Connaught Brand New🔥 [MUST VIEW],Cheras,650,1 300
"The hipster condo, taman desa [ CORNER LOT+FULLY FURNISHED ]",Taman Desa,958,2 100
"Fully Furnished 2r2b Amaya Maluri Condo For Rent, Cheras",Cheras,719,1 850
Suria Jelatek Condominium for Rent,Ampang Hilir,1089,2 300
[Must View] Desa Permai Condo in Taman Desa Old Klang Road,Taman Desa,1130,1 400
Duta Ria Segambut Solaris Dutamas Mont Kiara Changkat View Newly Reno,Solaris Dutamas,1292,2 400
[Rent] Fully furnished renovated condo near LRT,Pantai,805,2 000
Platinum OUG @ OUG near Kuchai Lama-STUDUO F.Furnished Good Facilities,Kuchai Lama,350,1 100
"Bayu Andaman Sentul , KL ( Near HKL )",Sentul,1001,1 499
10 Semantan Studio Damansara Heights 520SQFT FULLY FURNISHED+GOOD DEAL,Damansara Heights,520,1 500
Residensi Kuchaimas @ Kuchai Lama 805SQFT PARTLY FURNISHED+CHEAP DEAL,Kuchai Lama,805,1 500
Villa Orkid @ Segambut North Kiara 1893SQFT PARTLY FURNISHED+BIG UNIT,Segambut,1893,1 900
Maytower Studio KL City Dang Wangi 351SQFT FULLY FURNISHED+CHEAP DEAL,KL City,351,1 500
Zeta Deskye / Bayu Andaman Sentul KL ( Near HKL ),Sentul,1001,1 499
"The hamstead condo, bandar tasik selatan cheras [ FRIDGE/WASHER ]",Cheras,1003,1 588
LinqSky Residence @ Ampang for Rent (Mall & LRT),Keramat,736,2 500
Sri Petaling Endah Promenade Near Endah Parade Mall,Sri Petaling,980,1 800
"M Centura, Sentul Condo, Sentul Point, Maxim Citylights, Kuala Lumpur",Sentul,650,1 300
sinar magna for rent nice unit nice facing view,Kepong,825,1 100
rumah untuk disewa sri sentosa jalan klang lama,Old Klang Road,900,800
Court 28 @ KL City,Jalan Ipoh,934,2 000
2 Car Park + Kitchen Cabinet 😍 Villa Angsana Condo Jalan Ipoh,Jalan Ipoh,1100,1 299
Sri Jati 2 Old Klang Road Near KTM Partally Furnished 1200sqft,Old Klang Road,1200,1 300
Kenari court apartment for rent,Ampang,900,1 100
The Havre 3r3b 2cp Fullyfurnsih Iddesign Bukit Jalil Pavilion2 Apu Imu,Bukit Jalil,1100,2 400
(Available now)Bam villa Tmn Maluri Cheras Near Sunway velocity LRT,Cheras,1200,1 500
Vintage Point condo for Rent ,Desa Petaling,886,1 250
"The Herz Residence@Kepong,KL CHEAPEST Mizumi United Point Ativo",Kepong,1073,1 399
"Sky Meridien House for Rent, Near LRT",Sentul,792,2 500
ANYAMAN RESIDENCE@sungai besi / desa petaling / BTS / KUCHAI LAMA,Sungai Besi,935,1 350
Cheapest Desa Green Tmn desa Seputeh midvalley (Available Now),Taman Desa,936,1 450
"【Semi Furnished】【Corner Unit】3R2B Sri Putramas Condo, Jalan Kuching",Jalan Kuching,1100,1 400
"The hamstead condo, bandar tasik selatan cheras [ FULLY FURNISHED ]",Cheras,1003,1 799
Pelangi Indah Condo @ Jalan Ipoh,Jalan Ipoh,1024,1 200
Desa Pandan Pandanmas 2 Condo,Desa Pandan,900,1 350
Seasons Garden Residences Partly Wangsa Maju Sri Rampai LRT Aeon Lexa,Wangsa Maju,770,1 500
TR Residence Jalan Pekeliling Titiwangsa Jalan Tun Razak Kuala Lumpur,Titiwangsa,710,2 600
South View Residence Near LRT Kerinchi Um Bangsar South Kuala Lumpur,Bangsar South,648,2 300
Unit For Rent Hampshire Residences KLCC Area,KLCC,1270,4 200
"Rampai Residensi The Parc Sri Rampai,Setapak,Wangsa Maju, low rental",Setapak,850,1 850
KL City Desa Pandan Baiduri G WALK -UP Apartment,Desa Pandan,950,1 300
Anjung Hijau Greenfields Bukit Jalil Cheapest,Bukit Jalil,890,1 350
SkyAwani One Residensi Sentul Condo Kuala Lumpur,Sentul,800,1 700
UNA Serviced Apartment Jalan Peel Near Sunway Velocity MRT LRT,Cheras,829,4 200
Southbank Residence Old Klang Road Near Midvalley Bangsar,Old Klang Road,779,2 500
"Residensi Pandanmas 2, Desa Pandan, 90% fully furnish",Desa Pandan,900,1 500
Casa Ria Cheras Taman Maluri Condo Pandan Jaya Shamelin Perkasa KLCC,Cheras,1184,1 699
"Season Garden wangsa maju Near Lexa, Aeon Wangsawalk Jelatek",Wangsa Maju,770,2 000
"Berlian Residence Setapak ,New Unit ,3Room 2Bathroom",Setapak,900,1 500
"Berlian Residence Setapak, Duplex , 2 Car Park",Setapak,1805,2 000
Lakeville condo jalan ipoh kl fully furnish 2carpark,Jalan Ipoh,977,2 300
"PV 21 Condominium Setapak , Facing KLCC",Setapak,1300,1 500
"PPR Kampung Baru Air Panas ,Setapak",Setapak,650,1 000
"Residensi Harmoni 2 Near Toll Jalan Duta, Mont Kiara KTM Kepong Hosp",Segambut,1416,3 500
Lavile Condo Near AEON Cheras Columbia Asia BTHO Balakong,Cheras,956,3 800
Fortune Avenue @ Kepong Looking For New Tenant~,Kepong,1100,1 900
Season Garden Wangsa Maju below Market Price,Wangsa Maju,770,1 500
Meadow Park 2/Furnished/1 Parking/Kuchai Lama/Old Klang Road,Kuchai Lama,932,1 100
Menara Alpha Condo,Wangsa Maju,984,1 400
"Majestic Maxim Cheras, Kitchen cabinet, Air Cond., Taman Connaught MRT",Cheras,650,1 350
M Centura Condo In Sentul Fully Furnished For Rent/3R2B(Pool View),Sentul,850,2 000
TR Residence Level 32,Titiwangsa,850,2 000
Rampai Court Apartment for rent,Wangsa Maju,600,1 100
The Hamstead @ Desa Tun Razak Cheras/Partly Furnished/ 3r2b,Cheras,947,1 500
Sri Jati 2 Old Klang Road Klang Lama Mid Valley Kuala Lumpur,Old Klang Road,1200,1 300
"Suasana Lumayan Permaisuri, Special Unit, Big Balcony, 4 Rooms Limited",Cheras,1142,1 550
TTDI Plaza Taman Tun Dr Ismail Near One Utama OU LRT TTDI,Taman Tun Dr Ismail,2100,5 000
Pangsapuri/Apartment to Rent,Ampang,650,1 500
Maxim Residence Cheap Rent Good Condition Partial Furnish Cheras,Cheras,885,1 190
End Lot Fully Furnished Arte Jalan Ampang near KLCC Kuala Lumpur,Ampang,890,2 500
Majestic Maxim 819 Sqft Cheras Taman Connaught Fully Furnish Brand New,Cheras,819,2 000
"Fully Furnished apartment Queensville, bandar sri permaisuri, cheras",Cheras,526,1 800
"[FULLY FURNISHED] Desa Green, Taman Desa, KL",Taman Desa,1000,1 700
"KL Traders Square (KLTS), 3+1 Rooms, Fully Furnished, Jalan Gombak",Gombak,940,2 100
parking lot at Southlink / Bangsar South,KL City,10,200
"Residensi Pandanmas 2, Fully air conditioned, Kabinet dapur",Desa Pandan,900,1 400
The Holmes 2 @ Bandar Tun Razak Cheras KL View!!,Cheras,1102,1 800
Desa Satumas bangsar near kuchai lama kuala lumpur near midvalley,Taman Desa,850,1 100
"Cemara Apartment, Bandar Sri Permaisuri, Cheras, actual pic",Cheras,730,1 200
Kiara Residence 2 in bukit Jalil 20 mins driving to KL near LRT,Bukit Jalil,1200,2 200
Bayu Sentul Condo Facing KLCC Near UTC LRT P/F ID Design Cheaper,Sentul,1300,1 600
Bukit Jalil Pavillion The Park Sky Residence Condo [Fully Furnished],Bukit Jalil,1061,2 900
Midah Heights - low level unit for rent,Cheras,1090,1 600
Anggun residence KLCC Fully furnished ,KL City,752,3 000
BALCONY <3R2B> WELL KEPT @ Greenview Apartment Taman Pusat Kepong,Kepong,850,800
Ativo Suites Bandar Sri Damansara Kepong Fully/f 2 Rooms 2 carparks,Sri Damansara,751,2 550
"[SWIMMING POOL] The Holmes 2, Bandar Tun Razak, Cheras",Cheras,950,1 800
PV18 Setapak Danau Kota [2 carparks] Fully Furnished,Setapak,1021,2 400
NEGOTIABLE Astana Lumayan Bandar Sri Permaisuri Cheras,Cheras,1206,1 800
*Female Only* MasterBed Room with attached bathroom @ the Holmes,Cheras,1000,920
Suite Enesta🌈 Jinjang [ many units ]Kepong walking to MRT Jinjang,Kepong,916,1 500
PV9 Setapak Taman Melawati [2carparks] nr TARUMT LRT Wangsa Maju,Setapak,1000,2 200
The Hipster @ Taman Desa near MidValley 3R2B Partial Furnish for Rent,Taman Desa,921,1 800
Maluri Cheras - MVertica *FULLY FURNISH UNIT* For Rent,Cheras,850,2 300
Condominium Widuri Impian Desa Petaling KL,Desa Petaling,960,1 350
Icon Residence,Solaris Dutamas,731,2 700
"[New, Good Deal] The Mark Cheras, Taman Bukit Segar near Leisure Mall",Cheras,1163,2 550
Danau Idaman Taman Desa Old Klang Seputeh Fully Funished,Taman Desa,910,1 600
"Infiniti 3 Residence [ Actual Unit, 2 Parking ] 1515sf",Wangsa Maju,1515,2 600
"Irama Wangsa [ 3Bedroom 2Bathroom, 1200sf ] 2 Parking",Wangsa Maju,1200,1 999
apartment saujana ria paling murah untuk disewakan,Kepong,956,750
The Fennel Residence [ 3Bedroom 3Bathroom ] Parking,Sentul,1300,2 600
HOT Ascencia@TTDI Cosy Transit Unit Main 1R1B FF 1CP Big Balcony NEGO,Taman Tun Dr Ismail,840,3 300
Damai Residences 916sf 3BR Furnished Sg Besi KL,KL City,916,2 200
Iris Apartment .Taman Desa.Old Klang Road.,Taman Desa,800,1 000
"Platinum Teratai Residence 3R2B Kitchen cabinet opposite Pv18, 222 288",Setapak,928,1 499
Diamond Square Office,Setapak,890,1 500
Fully furnished at Sang Suria Condo for Rent,Sentul,1200,2 200
Damai Residences 700sf 2BR Furnished Sg Besi KL,KL City,700,1 700
"Perdana Puri, Kepong",Kepong,904,1 100
"2 car park, partly furnished, near taman connought MRT station",Cheras,819,1 600
Riana South Residence For Rent (10m-UCSI),Cheras,1232,4 200
Sky awani sentul 1 utk disewa,Sentul,800,1 500
New Unit for Rent,Cheras,819,1 700
"(Fully Furnished) The Palladium Condominium B, KL",Keramat,1195,2 000
Sam Mansion Flat,KL City,1000,600
"2bedroom Unio Residence, Kepong",Kepong,866,1 800
"Fully Furnished Blok Desa Angsana Apartment @ Bdr Damai Perdana, Chera",Cheras,650,1 000
Season Gardens Residence Seksyen 10 Wangsa Maju,Wangsa Maju,770,1 500
Fully Furnished MasterBed Room with attached bathroom @ the Holmes,Cheras,1000,800
"Aman Tiga, Kepong",Kepong,840,1 000
"Fully Furnish Secoya Residences @ Pantai Sentral Park, Kuala Lumpur",Pantai,1360,4 000
Fully Furnish Northpoint Residences Condo Mid Valley City Kuala Lumpur,Mid Valley City,1884,6 800
"Majestic Maxim Residence, Taman Bukit Cheras, Near MRT, Cheras",Cheras,650,1 500
"Wangsa Metroview Condo, LRT Wangsa Maju [KLCC View] #5",Wangsa Maju,1150,1 300
Nice Unit ！Midfields 2 Condominium 3R2B With Fully Furnished,Sungai Besi,1217,1 900
"For RENT- Pandan Perdana Shop Apartment,Kuala Lumpur,near to LRT",Ampang,850,900
"Full Furnish , Corinthian Condo 3R2B 1500sf , Walk to KLCC & MRT",KLCC,1500,3 300
"Amaya Maluri, 2rooms, 1cp, F/Furnished Near Velocity, Aeon, MRT Maluri",Cheras,719,1 800
Seroja Apartment|New Painted| Laman Rimbunan| Kepong MRT,Jinjang,650,850
"For Rent : PV10 Condo with pool view, available for rent in KL",Setapak,1100,1 700
"Lavile Residence, 2R2B, F/F KL ,Near MRT, Taman Maluri",Cheras,750,2 700
"[Fully furnish]Tiara Hatamas, Bukit Hatamas Cheras",Cheras,923,1 500
1680sf Corner Furnish Continental Heights Condokuchai Lama Old Klang,Old Klang Road,1679,2 300
[Fully furnished] Bukit Pandan Kondominium 1 Cheras,Cheras,1100,1 600
"Kiara east condo ,jalan kuching, 2 carpark, fully furnished, kl",KL City,698,1 800
[New complete] Chambers Residence walking PWTC and Train Station,KLCC,460,1 950
"New 3R2B unit PARTLY FURNISHED ready for RENT @ M CENTURA, Sentul",Sentul,850,1 400
"Majestic Maxim Service Residence Taman Len Seng, Batu 9, Cheras,",Cheras,819,1 400
"New 3R2B unit PARTLY FURNISHED ready for RENT @ M CENTURA, Sentul",Sentul,850,1 400
"Ready Move In Unit【FULLY FURNISHED】utk disewa @ M Centura, SENTUL",Sentul,650,1 200
Ready Move In 2Rooms 1Bath Unit For Rent【FULLY FURNISHED】@ M Centura,Sentul,650,1 300
South View Service Residence Bangsar South. Fully Furnished,Bangsar South,648,2 400
Savio Riana Dutamas Sagambut. Fully Furnished. Ready Move In.,Segambut,852,2 000
Marc Residence Studio KLCC,KLCC,500,2 300
Dex Suites 2.0 (Tower B)@ Kiara east,KL City,911,2 500
"28 Boulevard, Pandan Perdana, Shamelin, Pandan Jaya for rent",Pandan Perdana,450,1 650
Vista Komanwel C Condominium.Bukit Jalil. Sri Petaling.LRT,Bukit Jalil,1375,2 200
Seri Cendekia Condominimu .Taman Connaught.Cheras .,Cheras,1000,1 500
28 Boulevard. Pandan Perdana.Studio.MRT,Pandan Perdana,450,1 700
[4 Rooms Full Furnish] PPA1M Bukit Jalil near APU Easy Access LRT & KL,Bukit Jalil,1434,1 800
"Ascenda Residence bside Bennington, Kitchen cabinet, PV21 ZetaPark 2cp",Setapak,908,1 499
Apartment Rent At Brickfields,Brickfields,900,1 500
Desa green fully furnished/ taman desa / kuchai / cheras / kl,Taman Desa,935,2 100
"Blok 28 Apartment, Taman Batu Permai",Jalan Ipoh,730,1 000
Gembira Residen @ Happy Garden for Rent,Kuchai Lama,1578,2 500
South View 2r1b fully for rent,Bangsar South,691,2 400
VUE RESIDENCE Fully Furnish Near LRT and MRT Station@Titiwangsa HKL KL,Titiwangsa,900,2 100
KL Traders Square Tastefully furnished. 940sf with nice view.,Gombak,940,2 100
M Centura condo level swimming pool with 4 room and 2 parking@Sentul,Sentul,1001,2 400
For Rent: Spacious Bayu Tasik 2 Condo in Cheras,Cheras,960,1 500
Sri Putramas 1 condo for Rent,Jalan Kuching,1050,1 500
KL Traders Square condo small room FULLY FURNISHED,Gombak,1059,500
Aman Tiga Apartment Kepong,Kepong,840,1 000
Casa Mutiara Bukit Bintang Near KLCC Near LRT Station,Bukit Bintang,475,1 700
"Majestic Maxim 3R2B Ready Move In walk to MRT Connaught, Cheras",Cheras,819,1 500
Kiara Residence 2 in bukit Jalil 20 mins driving to KL near LRT,Bukit Jalil,1200,2 400
EcoSky Jalan Ipoh KL 2 Bedrooms Fully Furnished Unit With Balcony,Jalan Ipoh,904,1 800
Impiana Sky Residensi nr to jalilmas Pavilion Bukit Jalil,Bukit Jalil,850,1 100
10 Semantan Suites 2R2B FULLY FURNISHED 1CP Good Condition,Damansara Heights,950,1 900
"SkyAwani 3, Sky Awani 3, Partial furnished, move in condition",Setapak,800,1 500
Fully / F Klcc View Bam Villa Condominium Taman Maluri Cheras KL,Cheras,1150,1 800
M centura sentul ready move in fully furnish 3r2b near lrt mrt kl,Sentul,850,1 400
Tuan Residency Jalan Kuching 3R2B P/F Kepong Selayang Segambut KL,Jalan Kuching,878,1 600
"MH Platinum Residence, 3r2b1cp Basic Unit, Jalan Genting Klang Setapak",Setapak,1018,1 500
Hot Place!! Platinum Lake PV13 Danau Kota LRT Setapak Melawati,Setapak,1717,1 800
Residency V Old Klang Road 3R2B2CP F/FURNISHED near Bangsar Mid Valley,Old Klang Road,909,2 200
Rumah Flat Untuk Disewa Tingkat Bawah,Cheras,700,950
One stop residence pudu Walk distance MRT/LRT Chan Sow Lin STUDIO,KLCC,400,1 250
Suria Kipark Damansara Kepong Fully Furnisehd to Rent 3R2B1CP,Kepong,1000,1 200
I Zen Kiara 2 Mont Kiara Kuala Lumpur 3r3b F/F (Cheapest),Mont Kiara,1365,3 500
"FOR RENT BUKIT JALIL The Z Residence, Fully Furnished, Renovated",Bukit Jalil,1232,2 600
"Ascenda Residence F/Furnished Jalan Genting Klang, Setapak, Skyarena",Setapak,908,2 100
Majestic Maxim 2 Rooms Fully Furnish | MRT Connaught Cheras,Cheras,850,1 600
Bam Villa Condo 3r2b2c p/f near Sunway Velocity MRT Taman Maluri,Cheras,1200,1 600
Majestic Maxim Residence 2r2b1c p/f Taman Connaught EkoCheras Ucsi,Cheras,650,1 500
"Monte Bayu Condo, 3r2b Basic Unit, Taman Bukit Permai, Cheras Ampang",Cheras,850,1 200
Seri Maya Setiawangsa Kuala Lumpur 3r2b Fully (cheapest),Setiawangsa,1150,1 900
Ketumbar Heights Condo Taman Cheras Yulek Leisure Mall Eko Cheras,Cheras,908,1 000
Mont Kiara Astana Mont Kiara Kuala Lumpur 3r2b Fully (cheapest),Mont Kiara,1408,3 300
CondoRENT Dorsett Residences Sri Hartamas KL 585sf Studio Furnish,Sri Hartamas,585,1 800
Bangsar Puteri Bangsar Kuala Lumpur 3r2b Fully (Cheapest) Penthouse,Bangsar,1600,4 800
Platinum Lake Pv 13 Setapak. Well kept and clean. nice fittings.,Setapak,1313,2 000
1 Car Park / Avelon Beverly Tower Plaza Medan Putra Bandar Menjalara,Kepong,808,1 250
"Single room @ WIRAJAYA 2, Setapak, Melati, TARC, KL, LRT Melati",Setapak,850,450
Idaman Residence Condo KLCC 1797sf 3+1room Furnish,KLCC,1797,4 500
Fully Furnished Danau Permai Condominium Taman Desa,Taman Desa,685,2 000
Rumah Sewa Di Wangsa Maju Seksyen 2,Wangsa Maju,675,1 200
"Kepong Mas2 Apartment, Kepong, Kepong, Kepong, Kepong, Kepong, Kepong",Kepong,800,1 200
PARC 3 Walking distance to MRT & LRT 2 stops to TRX,Cheras,749,2 300
"Desa Permai Condo, 3 Room Partially Furnished Taman Desa Good Location",Taman Desa,1130,1 400
